{
  "analysis_context": {
    "analysis_unit": "subgraph",
    "anchor_time": "2022-09-15T00:00:00Z",
    "lookback_days": 7,
    "model_artifact": {
      "artifact_id": "baseline-rule-library-v0",
      "format": "json",
      "sha256": "proxy-demo-no-external-model",
      "uri": "artifact://baseline-rule-library-v0"
    },
    "outcome_days": 1,
    "outcome_metric": "old_rule_detection",
    "requested_validation_target": "model_behavior",
    "scoring_direction": "decrease_is_attack_success",
    "suggested_treatment": "relay_bridge_member"
  },
  "case_id": "proxy_relay_bridge_0001",
  "graph": {
    "amount_mode": "dual_endpoint",
    "directed": true,
    "edges": [
      {
        "amount_received": 1000,
        "amount_sent": 1000,
        "base_amount": 1000,
        "base_currency": "USD",
        "causal_role": "supporting",
        "dst": "IBM-HI-Proxy::B00::collector",
        "edge_id": "mut_e01",
        "mutation_role": "modified",
        "parent_edge_ids": [
          "base_e01"
        ],
        "payment_format": "ACH",
        "receiving_currency": "USD",
        "scope": "candidate",
        "sent_currency": "USD",
        "src": "IBM-HI-Proxy::B00::s1",
        "timestamp": 0,
        "transaction_type": "TRANSFER"
      },
      {
        "amount_received": 1100,
        "amount_sent": 1100,
        "base_amount": 1100,
        "base_currency": "USD",
        "causal_role": "supporting",
        "dst": "IBM-HI-Proxy::B00::collector",
        "edge_id": "mut_e02",
        "mutation_role": "modified",
        "parent_edge_ids": [
          "base_e02"
        ],
        "payment_format": "ACH",
        "receiving_currency": "USD",
        "scope": "candidate",
        "sent_currency": "USD",
        "src": "IBM-HI-Proxy::B00::s2",
        "timestamp": 60,
        "transaction_type": "TRANSFER"
      },
      {
        "amount_received": 900,
        "amount_sent": 900,
        "base_amount": 900,
        "base_currency": "USD",
        "causal_role": "supporting",
        "dst": "IBM-HI-Proxy::B00::collector",
        "edge_id": "mut_e03",
        "mutation_role": "modified",
        "parent_edge_ids": [
          "base_e03"
        ],
        "payment_format": "ACH",
        "receiving_currency": "USD",
        "scope": "candidate",
        "sent_currency": "USD",
        "src": "IBM-HI-Proxy::B00::s3",
        "timestamp": 120,
        "transaction_type": "TRANSFER"
      },
      {
        "amount_received": 2850,
        "amount_sent": 2850,
        "base_amount": 2850,
        "base_currency": "USD",
        "causal_role": "essential",
        "dst": "IBM-HI-Proxy::B00::relay",
        "edge_id": "mut_e04",
        "mutation_role": "added",
        "parent_edge_ids": [
          "base_hub_split"
        ],
        "payment_format": "ACH",
        "receiving_currency": "USD",
        "scope": "candidate",
        "sent_currency": "USD",
        "src": "IBM-HI-Proxy::B00::collector",
        "timestamp": 3600,
        "transaction_type": "TRANSFER"
      },
      {
        "amount_received": 900,
        "amount_sent": 900,
        "base_amount": 900,
        "base_currency": "USD",
        "causal_role": "supporting",
        "dst": "IBM-HI-Proxy::B00::d1",
        "edge_id": "mut_e05",
        "mutation_role": "modified",
        "parent_edge_ids": [
          "base_e04"
        ],
        "payment_format": "ACH",
        "receiving_currency": "USD",
        "scope": "candidate",
        "sent_currency": "USD",
        "src": "IBM-HI-Proxy::B00::relay",
        "timestamp": 3900,
        "transaction_type": "TRANSFER"
      },
      {
        "amount_received": 850,
        "amount_sent": 850,
        "base_amount": 850,
        "base_currency": "USD",
        "causal_role": "supporting",
        "dst": "IBM-HI-Proxy::B00::d2",
        "edge_id": "mut_e06",
        "mutation_role": "modified",
        "parent_edge_ids": [
          "base_e05"
        ],
        "payment_format": "ACH",
        "receiving_currency": "USD",
        "scope": "candidate",
        "sent_currency": "USD",
        "src": "IBM-HI-Proxy::B00::relay",
        "timestamp": 3960,
        "transaction_type": "TRANSFER"
      },
      {
        "amount_received": 950,
        "amount_sent": 950,
        "base_amount": 950,
        "base_currency": "USD",
        "causal_role": "supporting",
        "dst": "IBM-HI-Proxy::B00::d3",
        "edge_id": "mut_e07",
        "mutation_role": "modified",
        "parent_edge_ids": [
          "base_e06"
        ],
        "payment_format": "ACH",
        "receiving_currency": "USD",
        "scope": "candidate",
        "sent_currency": "USD",
        "src": "IBM-HI-Proxy::B00::relay",
        "timestamp": 4020,
        "transaction_type": "TRANSFER"
      },
      {
        "amount_received": 120,
        "amount_sent": 120,
        "base_amount": 120,
        "base_currency": "USD",
        "causal_role": "nuisance",
        "dst": "IBM-HI-Proxy::B00::normal",
        "edge_id": "mut_e08",
        "mutation_role": "added",
        "parent_edge_ids": [
          "base_decoy_seed"
        ],
        "payment_format": "ACH",
        "receiving_currency": "USD",
        "scope": "context",
        "sent_currency": "USD",
        "src": "IBM-HI-Proxy::B00::collector",
        "timestamp": 1800,
        "transaction_type": "TRANSFER"
      },
      {
        "amount_received": 100,
        "amount_sent": 100,
        "base_amount": 100,
        "base_currency": "USD",
        "causal_role": "nuisance",
        "dst": "IBM-HI-Proxy::B00::relay",
        "edge_id": "mut_e09",
        "mutation_role": "added",
        "parent_edge_ids": [
          "base_decoy_seed"
        ],
        "payment_format": "ACH",
        "receiving_currency": "USD",
        "scope": "context",
        "sent_currency": "USD",
        "src": "IBM-HI-Proxy::B00::normal",
        "timestamp": 3300,
        "transaction_type": "TRANSFER"
      }
    ],
    "multigraph": true,
    "nodes": [
      {
        "attrs": {},
        "node_id": "IBM-HI-Proxy::B00::s1"
      },
      {
        "attrs": {},
        "node_id": "IBM-HI-Proxy::B00::s2"
      },
      {
        "attrs": {},
        "node_id": "IBM-HI-Proxy::B00::s3"
      },
      {
        "attrs": {},
        "node_id": "IBM-HI-Proxy::B00::collector"
      },
      {
        "attrs": {},
        "node_id": "IBM-HI-Proxy::B00::relay"
      },
      {
        "attrs": {},
        "node_id": "IBM-HI-Proxy::B00::d1"
      },
      {
        "attrs": {},
        "node_id": "IBM-HI-Proxy::B00::d2"
      },
      {
        "attrs": {},
        "node_id": "IBM-HI-Proxy::B00::d3"
      },
      {
        "attrs": {},
        "node_id": "IBM-HI-Proxy::B00::normal"
      }
    ],
    "time_origin": "2022-09-01T00:00:00Z",
    "time_precision": 1.0,
    "time_unit": "second"
  },
  "mutation": {
    "attack_id": "attack_proxy_0001",
    "attack_success": true,
    "attack_type": "path_extension",
    "base_case_features": {
      "hub_count": 1
    },
    "changed_features": [
      "path_length",
      "holding_time",
      "context_edge_ratio"
    ],
    "failed_rule_conditions": [
      "single_hub_required"
    ],
    "mutated_case_features": {
      "hub_count": 2
    },
    "old_rule_result": {
      "after_attack": false,
      "before_attack": true
    },
    "parameters": {
      "decoy_edges": 2,
      "delay_seconds": 3480,
      "inserted_relays": 1
    },
    "stable_features": [
      "three_sources",
      "three_sinks",
      "flow_conservation"
    ]
  },
  "package_type": "validated_subgraph",
  "provenance": {
    "created_at": "2026-08-22T12:00:00Z",
    "generator": "proxy_mutator/v0.2",
    "generator_version": "0.2.0",
    "mutation_ops": [
      "split_hub",
      "add_delay",
      "inject_decoy_edges"
    ],
    "parent_motif": "gather_scatter",
    "random_seed": 42,
    "round": 1,
    "source_artifact_sha256": "proxy-demo-deterministic-fixture",
    "source_dataset_id": "IBM-HI-Proxy"
  },
  "schema_version": "ccem.validated_subgraph/v0.2",
  "validation": {
    "accepted": true,
    "adjustment_set": [
      "edge_count",
      "duration",
      "total_amount"
    ],
    "aggregate": {
      "ci95": [
        0.18,
        0.44
      ],
      "control_n": 64,
      "effect_size": 0.31,
      "p_value": 0.008,
      "q_value": 0.012,
      "sample_size": 128,
      "treated_n": 64
    },
    "analysis_unit": "subgraph",
    "counterfactuals": [
      {
        "intervention": {
          "edge_ids": [
            "mut_e04"
          ],
          "type": "remove_edges"
        },
        "name": "bridge_removal",
        "result": {
          "matched_after": false,
          "score_drop": 1.0
        }
      },
      {
        "intervention": {
          "rewires": [
            {
              "edge_id": "mut_e04",
              "new_dst": "IBM-HI-Proxy::B00::normal",
              "new_src": "IBM-HI-Proxy::B00::collector"
            }
          ],
          "type": "rewire_edges"
        },
        "name": "degree_preserving_rewire",
        "result": {
          "matched_after": false,
          "score_drop": 1.0
        }
      },
      {
        "intervention": {
          "random_seed": 42,
          "timestamp_mapping": {
            "mut_e04": 3600,
            "mut_e05": 3000,
            "mut_e06": 3060,
            "mut_e07": 3120
          },
          "type": "shuffle_timestamps"
        },
        "name": "temporal_reversal",
        "result": {
          "matched_after": false,
          "score_drop": 0.75
        }
      },
      {
        "intervention": {
          "amount_mapping": {
            "mut_e04": {
              "base_amount": 120.0
            },
            "mut_e08": {
              "base_amount": 2850.0
            }
          },
          "random_seed": 42,
          "type": "permute_amounts"
        },
        "name": "amount_permutation",
        "result": {
          "matched_after": false,